{
  "skill": "relationship-review-resolution",
  "version": "0.1.0",
  "status": "needs_review",
  "ingestion_skill": "relationship-ingestion",
  "processed_at": "2026-04-18T02:07:09.176Z",
  "review_summary": {
    "decision_count": 2,
    "committed_count": 2,
    "created_count": 1,
    "updated_count": 1,
    "ignored_count": 1,
    "deferred_count": 0,
    "unresolved_count": 1,
    "auto_committed_count": 1
  },
  "committed_profiles": [
    {
      "person_name": "剑锋",
      "person_ref": "person_jian_feng",
      "resolution_action": "update",
      "profile_tier": "key",
      "confidence": "high",
      "aliases": [
        "JF"
      ],
      "compiled_truth": {
        "summary": "理性调停型技术负责人。",
        "current_judgment": "对天气项目和 demo 的取舍非常清醒，更倾向优先厘清分工和优先级。",
        "relationship_stage": "稳定联系",
        "intent": "推动分工厘清，避免天气和 demo 同时做导致两边都做不好。",
        "attitude": {
          "label": "理性谨慎",
          "reason": "对上层真实优先级有保留判断。"
        },
        "traits": [
          "数据导向",
          "说话留余地",
          "理性克制"
        ],
        "tags": [
          "算法负责人",
          "技术侧"
        ],
        "preferences": [
          "同步真实决策动态"
        ],
        "boundaries": [
          "不喜欢只谈愿景不谈约束"
        ],
        "risk_flags": [
          "如果分工继续模糊，天气项目可能被降级。"
        ],
        "open_questions": [
          "决策权到底在斌哥还是更上层？"
        ],
        "next_actions": [
          "关注剑锋向上沟通后的结果"
        ]
      },
      "timeline": [],
      "evidence_summary": {
        "excerpt_count": 1,
        "source_count": 1,
        "last_updated_at": "2026-04-18T02:07:09.176Z",
        "key_evidence": [
          "数据导向，大量用数据和逻辑说话。"
        ]
      },
      "linked_relationships": {
        "detected_as": true,
        "matched_existing_person_id": "person_jian_feng",
        "matched_existing_person_name": "剑锋"
      }
    },
    {
      "person_name": "贵彬",
      "person_ref": "person_gui_bin",
      "resolution_action": "create",
      "profile_tier": "active",
      "confidence": "high",
      "aliases": [],
      "compiled_truth": {
        "summary": "天气Agent执行层核心接口人。",
        "current_judgment": "天气Agent执行层核心接口人。",
        "relationship_stage": "初识",
        "intent": "希望雁然或剑锋去推动分工厘清，自己已推到极限。",
        "attitude": {
          "label": "谨慎偏悲观",
          "reason": "已经接受天气项目可能被压低优先级。"
        },
        "traits": [
          "务实直接",
          "不擅长组织政治"
        ],
        "tags": [
          "算法侧",
          "天气Agent执行层",
          "信息黑洞受害者"
        ],
        "preferences": [],
        "boundaries": [],
        "risk_flags": [
          "如果后续分工继续不清，执行层会快速失去信心。"
        ],
        "open_questions": [
          "用户备注：确认纳入天气项目执行层关键接口人。"
        ],
        "next_actions": [
          "保持对贵彬的信息同步，减少执行层信息盲区。"
        ]
      },
      "timeline": [],
      "evidence_summary": {
        "excerpt_count": 1,
        "source_count": 0,
        "last_updated_at": "2026-04-18T02:07:09.176Z",
        "key_evidence": [
          "与斌哥今天上午已聊过多轮，基本聊不通。"
        ]
      },
      "linked_relationships": {
        "detected_as": true,
        "matched_existing_person_id": null,
        "matched_existing_person_name": "贵彬"
      }
    }
  ],
  "created_people": [
    {
      "person_name": "贵彬",
      "person_ref": "person_gui_bin",
      "profile_tier": "active",
      "source": "review"
    }
  ],
  "updated_people": [
    {
      "person_name": "剑锋",
      "person_ref": "person_jian_feng",
      "profile_tier": "key",
      "source": "auto"
    }
  ],
  "ignored_people": [
    {
      "person_name": "萌萌",
      "reason": "本轮先不建档，只作为背景人物保留在纪要里。",
      "source": "review"
    }
  ],
  "deferred_people": [],
  "unresolved_candidates": [
    {
      "person_name": "郑浩",
      "suggested_action": "create",
      "confidence": "medium",
      "reason": "郑浩未来是继续参与天气项目，还是会被调去做 demo？"
    }
  ],
  "profile_store_delta": {
    "upserts": [
      {
        "person_name": "剑锋",
        "person_ref": "person_jian_feng",
        "resolution_action": "update",
        "profile_tier": "key",
        "confidence": "high",
        "aliases": [
          "JF"
        ],
        "compiled_truth": {
          "summary": "理性调停型技术负责人。",
          "current_judgment": "对天气项目和 demo 的取舍非常清醒，更倾向优先厘清分工和优先级。",
          "relationship_stage": "稳定联系",
          "intent": "推动分工厘清，避免天气和 demo 同时做导致两边都做不好。",
          "attitude": {
            "label": "理性谨慎",
            "reason": "对上层真实优先级有保留判断。"
          },
          "traits": [
            "数据导向",
            "说话留余地",
            "理性克制"
          ],
          "tags": [
            "算法负责人",
            "技术侧"
          ],
          "preferences": [
            "同步真实决策动态"
          ],
          "boundaries": [
            "不喜欢只谈愿景不谈约束"
          ],
          "risk_flags": [
            "如果分工继续模糊，天气项目可能被降级。"
          ],
          "open_questions": [
            "决策权到底在斌哥还是更上层？"
          ],
          "next_actions": [
            "关注剑锋向上沟通后的结果"
          ]
        },
        "timeline": [],
        "evidence_summary": {
          "excerpt_count": 1,
          "source_count": 1,
          "last_updated_at": "2026-04-18T02:07:09.176Z",
          "key_evidence": [
            "数据导向，大量用数据和逻辑说话。"
          ]
        },
        "linked_relationships": {
          "detected_as": true,
          "matched_existing_person_id": "person_jian_feng",
          "matched_existing_person_name": "剑锋"
        }
      },
      {
        "person_name": "贵彬",
        "person_ref": "person_gui_bin",
        "resolution_action": "create",
        "profile_tier": "active",
        "confidence": "high",
        "aliases": [],
        "compiled_truth": {
          "summary": "天气Agent执行层核心接口人。",
          "current_judgment": "天气Agent执行层核心接口人。",
          "relationship_stage": "初识",
          "intent": "希望雁然或剑锋去推动分工厘清，自己已推到极限。",
          "attitude": {
            "label": "谨慎偏悲观",
            "reason": "已经接受天气项目可能被压低优先级。"
          },
          "traits": [
            "务实直接",
            "不擅长组织政治"
          ],
          "tags": [
            "算法侧",
            "天气Agent执行层",
            "信息黑洞受害者"
          ],
          "preferences": [],
          "boundaries": [],
          "risk_flags": [
            "如果后续分工继续不清，执行层会快速失去信心。"
          ],
          "open_questions": [
            "用户备注：确认纳入天气项目执行层关键接口人。"
          ],
          "next_actions": [
            "保持对贵彬的信息同步，减少执行层信息盲区。"
          ]
        },
        "timeline": [],
        "evidence_summary": {
          "excerpt_count": 1,
          "source_count": 0,
          "last_updated_at": "2026-04-18T02:07:09.176Z",
          "key_evidence": [
            "与斌哥今天上午已聊过多轮，基本聊不通。"
          ]
        },
        "linked_relationships": {
          "detected_as": true,
          "matched_existing_person_id": null,
          "matched_existing_person_name": "贵彬"
        }
      }
    ],
    "ignored_people": [
      {
        "person_name": "萌萌",
        "reason": "本轮先不建档，只作为背景人物保留在纪要里。",
        "source": "review"
      }
    ],
    "deferred_people": [],
    "auto_committed_people": [
      "剑锋"
    ],
    "store_path": "D:/Lenny_Bcontext/skill-system/relationship-ingestion/runtime/stores/sample-review-store.json",
    "written": false,
    "total_profiles_after_write": 2
  },
  "notes": "样例：确认一个新增人物、自动通过一个稳定更新、忽略一个噪音候选。"
}
